{
  "$schema": "https://json-schema.org/draft/2020-12/schema",
  "$id": "openmontage/artifacts/edit_decisions",
  "title": "Edit Decisions",
  "description": "Editorial decisions produced by the Edit Agent.",
  "type": "object",
  "required": ["version", "cuts", "render_runtime"],
  "properties": {
    "version": { "type": "string", "const": "1.0" },
    "project_id": {
      "type": "string",
      "pattern": "^[A-Za-z0-9][A-Za-z0-9._-]{0,127}$"
    },
    "pipeline_type": { "type": "string", "minLength": 1 },
    "run_id": {
      "type": "string",
      "pattern": "^[0-9a-f]{8}-[0-9a-f]{4}-[4][0-9a-f]{3}-[89ab][0-9a-f]{3}-[0-9a-f]{12}$"
    },
    "target_duration_seconds": { "type": "number", "minimum": 1 },
    "output_profile": { "type": "string", "minLength": 1 },
    "profile": { "type": "string", "minLength": 1 },
    "aspect_ratio": { "type": "string", "enum": ["16:9", "9:16", "1:1", "21:9", "4:3"] },
    "cuts": {
      "type": "array",
      "items": {
        "type": "object",
        "required": ["id", "source", "in_seconds", "out_seconds"],
        "properties": {
          "id": { "type": "string" },
          "source": { "type": "string", "description": "Source file path or asset-manifest ID" },
          "type": { "type": "string", "description": "Optional renderer component type" },
          "surfaceColor": { "type": "string", "description": "Optional surface color override for a renderer component" },
          "mutedColor": { "type": "string", "description": "Optional muted text color override for a renderer component" },
          "backgroundColor": { "type": "string", "description": "Optional background color override for a renderer component" },
          "accentColor": { "type": "string", "description": "Optional accent color override for a renderer component" },
          "color": { "type": "string", "description": "Optional text color override for a renderer component" },
          "in_seconds": { "type": "number", "minimum": 0 },
          "out_seconds": { "type": "number", "minimum": 0 },
          "speed": { "type": "number", "minimum": 0.1, "default": 1.0 },
          "layer": {
            "type": "string",
            "enum": ["primary", "overlay", "background"],
            "default": "primary"
          },
          "transform": {
            "type": "object",
            "properties": {
              "scale": { "type": "number", "minimum": 0, "default": 1.0 },
              "position": { "type": "string", "default": "center" },
              "animation": {
                "type": "string",
                "description": "Motion applied to still images (e.g. ken-burns-slow-zoom, pan-left, static)"
              },
              "crop": {
                "type": "object",
                "properties": {
                  "x": { "type": "number" },
                  "y": { "type": "number" },
                  "width": { "type": "number" },
                  "height": { "type": "number" }
                }
              }
            },
            "additionalProperties": false
          },
          "transition_in": {
            "type": "string",
            "description": "Transition type entering this cut (e.g. fade, dissolve, cut, wipe)"
          },
          "transition_out": {
            "type": "string",
            "description": "Transition type leaving this cut"
          },
          "transition_duration": {
            "type": "number",
            "minimum": 0,
            "description": "Duration of transition in seconds"
          },
          "teacher_slide": {
            "type": "object",
            "description": "Structured teaching-slide data for animated text and diagram primitives.",
            "required": ["title", "section", "bullets", "diagram"],
            "properties": {
              "title": { "type": "string" },
              "section": { "type": "string" },
              "bullets": {
                "type": "array",
                "items": { "type": "string" },
                "minItems": 1,
                "maxItems": 3
              },
              "diagram": { "type": "string" },
              "keyTakeaway": { "type": "string" },
              "diagramExplanation": { "type": "string" },
              "visualTarget": { "type": "string" },
              "slideNumber": { "type": "integer", "minimum": 1 },
              "slideCount": { "type": "integer", "minimum": 1 },
              "visualVariant": {
                "type": "string",
                "enum": ["balanced-grid", "diagram-focus", "minimal-lecture"]
              }
            },
            "additionalProperties": false
          },
          "reason": { "type": "string" }
        },
        "additionalProperties": false
      }
    },
    "overlays": {
      "type": "array",
      "items": {
        "type": "object",
        "required": ["asset_id", "start_seconds", "end_seconds", "position"],
        "properties": {
          "asset_id": { "type": "string" },
          "start_seconds": { "type": "number", "minimum": 0 },
          "end_seconds": { "type": "number", "minimum": 0 },
          "position": {
            "type": "object",
            "properties": {
              "x": { "type": "number" },
              "y": { "type": "number" },
              "width": { "type": "number" },
              "height": { "type": "number" }
            },
            "required": ["x", "y"]
          },
          "animation": { "type": "string" },
          "opacity": { "type": "number", "minimum": 0, "maximum": 1 }
        },
        "additionalProperties": false
      }
    },
    "audio": {
      "type": "object",
      "description": "Audio configuration for narration, music, and SFX.",
      "properties": {
        "narration": {
          "type": "object",
          "properties": {
            "segments": {
              "type": "array",
              "items": {
                "type": "object",
                "required": ["asset_id", "start_seconds"],
                "properties": {
                  "asset_id": { "type": "string" },
                  "start_seconds": { "type": "number", "minimum": 0 },
                  "end_seconds": { "type": "number", "minimum": 0 },
                  "offset_seconds": { "type": "number", "minimum": 0 },
                  "volume": { "type": "number", "minimum": 0, "maximum": 1 }
                },
                "additionalProperties": false
              }
            }
          }
        },
        "music": {
          "type": "object",
          "properties": {
            "asset_id": { "type": "string" },
            "volume": { "type": "number", "minimum": 0, "maximum": 1 },
            "offset_seconds": { "type": "number", "minimum": 0 },
            "loop": { "type": "boolean", "default": false },
            "fade_in_seconds": { "type": "number", "minimum": 0 },
            "fade_out_seconds": { "type": "number", "minimum": 0 },
            "ducking": {
              "oneOf": [
                { "type": "boolean" },
                {
                  "type": "object",
                  "properties": {
                    "enabled": { "type": "boolean", "default": true },
                    "threshold_db": { "type": "number" },
                    "reduction_db": { "type": "number" },
                    "attack_ms": { "type": "number", "minimum": 0 },
                    "release_ms": { "type": "number", "minimum": 0 }
                  },
                  "additionalProperties": false
                }
              ]
            }
          }
        },
        "sfx": {
          "type": "array",
          "items": {
            "type": "object",
              "properties": {
              "asset_id": { "type": "string" },
              "start_seconds": { "type": "number", "minimum": 0 },
              "end_seconds": { "type": "number", "minimum": 0 },
              "offset_seconds": { "type": "number", "minimum": 0 },
              "volume": { "type": "number", "minimum": 0, "maximum": 1, "default": 1.0 }
            },
            "additionalProperties": false
          }
        }
      },
      "additionalProperties": false
    },
    "subtitles": {
      "type": "object",
      "properties": {
        "enabled": { "type": "boolean" },
        "style": { "type": "string", "description": "Display style: sentence, word-by-word, karaoke" },
        "source": { "type": "string", "description": "Path to subtitle file or asset ID" },
        "font": { "type": "string" },
        "font_size": { "type": "integer" },
        "color": { "type": "string", "description": "Primary text color (hex or ASS format)" },
        "outline_color": { "type": "string" },
        "background": { "type": "string", "description": "Background color with optional alpha (e.g. #00000088)" },
        "position": { "type": "string", "enum": ["top-center", "bottom-center", "center"] },
        "max_words_per_line": { "type": "integer", "minimum": 1 }
      },
      "additionalProperties": false
    },
    "music": {
      "type": "object",
      "description": "Legacy top-level music config. Prefer audio.music for new pipelines.",
      "properties": {
        "asset_id": { "type": "string" },
        "volume": { "type": "number", "minimum": 0, "maximum": 1 },
        "offset_seconds": { "type": "number", "minimum": 0 },
        "loop": { "type": "boolean", "default": false },
        "ducking": { "type": "boolean", "default": true },
        "fade_in_seconds": { "type": "number", "minimum": 0 },
        "fade_out_seconds": { "type": "number", "minimum": 0 }
      }
    },
    "transitions": {
      "type": "array",
      "description": "Global transition list. Per-cut transitions in cuts[].transition_in/out are preferred.",
      "items": {
        "type": "object",
        "properties": {
          "type": { "type": "string" },
          "at_seconds": { "type": "number" },
          "duration_seconds": { "type": "number", "minimum": 0 }
        },
        "required": ["type", "at_seconds", "duration_seconds"]
      }
    },
    "renderer_family": {
      "type": "string",
      "enum": ["explainer-data", "explainer-teacher", "cinematic-trailer", "documentary-montage", "product-reveal", "screen-demo", "presenter", "animation-first"],
      "description": "Locked at proposal stage — creative grammar for this deliverable. Preserved from proposal_packet; edit MUST NOT change without a logged decision."
    },
    "render_runtime": {
      "type": "string",
      "enum": ["remotion", "hyperframes", "ffmpeg"],
      "description": "Locked at proposal stage — technical runtime that realizes renderer_family. Edit MUST carry this forward unchanged unless a logged render_runtime_selection decision overrides it."
    },
    "composition_mode": {
      "type": "string",
      "enum": ["templated", "atelier"],
      "description": "Locked at proposal — HOW the composition is built. Edit MUST carry forward unchanged. 'atelier' routes video_compose to _render_via_atelier (no cut-schema, no stock registry); requires `bespoke` block below."
    },
    "bespoke": {
      "type": "object",
      "description": "Required when composition_mode='atelier'. Contract for the hand-authored, project-local Remotion render. See tools/video/video_compose.py → _render_via_atelier docstring.",
      "required": ["entry", "composition_id", "art_direction"],
      "properties": {
        "entry": { "type": "string", "description": "Path to the project-local Remotion entry .tsx (typically projects/<slug>/index.tsx). If outside remotion-composer/, auto-staged via directory junction/symlink at render time." },
        "composition_id": { "type": "string", "description": "id registered in that entry's Root" },
        "art_direction": { "type": "string", "description": "Short commitment to a fresh visual language (or a path to art-direction.md). REQUIRED — enforced by _run_atelier_checks." },
        "props_path": { "type": "string", "description": "Absolute path to a props JSON (Remotion --props)" },
        "public_dir": { "type": "string", "description": "Per-project public dir (avoids copying the bloated shared remotion-composer/public/)" },
        "scale": { "type": "number", "minimum": 0.1, "maximum": 1.0 },
        "crf": { "type": "integer", "minimum": 0, "maximum": 51 },
        "concurrency": { "type": "integer", "minimum": 1 }
      }
    },
    "slideshow_risk_score": {
      "type": "object",
      "description": "Slideshow risk assessment from lib/slideshow_risk.py",
      "properties": {
        "average": { "type": "number" },
        "verdict": { "type": "string", "enum": ["strong", "acceptable", "revise", "fail"] }
      }
    },
    "metadata": { "type": "object" }
  },
  "additionalProperties": false
}
